{
  "schemaVersion": "0.1",
  "status": "voorlopig",
  "name": "amateur",
  "starters": [
    {
      "id": "GK",
      "name": "Jorre Veldakker",
      "role": "keeper",
      "preferredPosition": "GK",
      "attributes": {
        "passing": 9,
        "firstTouch": 10,
        "finishing": 10,
        "dribbling": 10,
        "defending": 10,
        "heading": 11,
        "speed": 12,
        "acceleration": 13,
        "strength": 13,
        "endurance": 10,
        "vision": 7,
        "anticipation": 6,
        "positioning": 5,
        "decisions": 8,
        "discipline": 11
      },
      "keeper": {
        "reflexes": 6,
        "positioning": 6,
        "rushingOut": 6
      }
    },
    {
      "id": "RB",
      "name": "Marniek Zandhorst",
      "role": "back",
      "preferredPosition": "RB",
      "attributes": {
        "passing": 9,
        "firstTouch": 10,
        "finishing": 10,
        "dribbling": 10,
        "defending": 10,
        "heading": 11,
        "speed": 12,
        "acceleration": 13,
        "strength": 13,
        "endurance": 10,
        "vision": 7,
        "anticipation": 6,
        "positioning": 5,
        "decisions": 8,
        "discipline": 11
      }
    },
    {
      "id": "RC",
      "name": "Tijmen Rietweide",
      "role": "centrale_verdediger",
      "preferredPosition": "RC",
      "attributes": {
        "passing": 9,
        "firstTouch": 10,
        "finishing": 7,
        "dribbling": 10,
        "defending": 11,
        "heading": 11,
        "speed": 12,
        "acceleration": 13,
        "strength": 13,
        "endurance": 10,
        "vision": 7,
        "anticipation": 6,
        "positioning": 5,
        "decisions": 8,
        "discipline": 11
      }
    },
    {
      "id": "LC",
      "name": "Wessel Brinkwaard",
      "role": "centrale_verdediger",
      "preferredPosition": "LC",
      "attributes": {
        "passing": 9,
        "firstTouch": 10,
        "finishing": 7,
        "dribbling": 10,
        "defending": 11,
        "heading": 11,
        "speed": 12,
        "acceleration": 13,
        "strength": 13,
        "endurance": 10,
        "vision": 7,
        "anticipation": 6,
        "positioning": 5,
        "decisions": 8,
        "discipline": 11
      }
    },
    {
      "id": "LB",
      "name": "Nout Korenbeek",
      "role": "back",
      "preferredPosition": "LB",
      "attributes": {
        "passing": 9,
        "firstTouch": 10,
        "finishing": 10,
        "dribbling": 10,
        "defending": 10,
        "heading": 11,
        "speed": 12,
        "acceleration": 13,
        "strength": 13,
        "endurance": 10,
        "vision": 7,
        "anticipation": 6,
        "positioning": 5,
        "decisions": 8,
        "discipline": 11
      }
    },
    {
      "id": "RM",
      "name": "Jelmer Eikenwaard",
      "role": "buitenspeler",
      "preferredPosition": "RM",
      "attributes": {
        "passing": 9,
        "firstTouch": 10,
        "finishing": 10,
        "dribbling": 10,
        "defending": 10,
        "heading": 11,
        "speed": 12,
        "acceleration": 13,
        "strength": 13,
        "endurance": 10,
        "vision": 7,
        "anticipation": 6,
        "positioning": 5,
        "decisions": 8,
        "discipline": 11
      }
    },
    {
      "id": "RCM",
      "name": "Sietse Dalhoven",
      "role": "controlerende_middenvelder",
      "preferredPosition": "RCM",
      "attributes": {
        "passing": 9,
        "firstTouch": 10,
        "finishing": 10,
        "dribbling": 10,
        "defending": 10,
        "heading": 11,
        "speed": 12,
        "acceleration": 13,
        "strength": 13,
        "endurance": 10,
        "vision": 7,
        "anticipation": 6,
        "positioning": 5,
        "decisions": 8,
        "discipline": 11
      }
    },
    {
      "id": "LCM",
      "name": "Bauke Veenakker",
      "role": "controlerende_middenvelder",
      "preferredPosition": "LCM",
      "attributes": {
        "passing": 9,
        "firstTouch": 10,
        "finishing": 10,
        "dribbling": 10,
        "defending": 10,
        "heading": 11,
        "speed": 12,
        "acceleration": 13,
        "strength": 13,
        "endurance": 10,
        "vision": 7,
        "anticipation": 6,
        "positioning": 5,
        "decisions": 8,
        "discipline": 11
      }
    },
    {
      "id": "LM",
      "name": "Rens Kiezelhorst",
      "role": "buitenspeler",
      "preferredPosition": "LM",
      "attributes": {
        "passing": 9,
        "firstTouch": 10,
        "finishing": 10,
        "dribbling": 10,
        "defending": 10,
        "heading": 11,
        "speed": 12,
        "acceleration": 13,
        "strength": 13,
        "endurance": 10,
        "vision": 7,
        "anticipation": 6,
        "positioning": 5,
        "decisions": 8,
        "discipline": 11
      }
    },
    {
      "id": "RS",
      "name": "Koen Meerveldt",
      "role": "spits",
      "preferredPosition": "RS",
      "attributes": {
        "passing": 9,
        "firstTouch": 10,
        "finishing": 11,
        "dribbling": 10,
        "defending": 8,
        "heading": 11,
        "speed": 12,
        "acceleration": 13,
        "strength": 13,
        "endurance": 10,
        "vision": 7,
        "anticipation": 6,
        "positioning": 5,
        "decisions": 8,
        "discipline": 11
      }
    },
    {
      "id": "LS",
      "name": "Floris Houtkampen",
      "role": "targetman",
      "preferredPosition": "LS",
      "attributes": {
        "passing": 9,
        "firstTouch": 10,
        "finishing": 11,
        "dribbling": 10,
        "defending": 8,
        "heading": 11,
        "speed": 12,
        "acceleration": 13,
        "strength": 13,
        "endurance": 10,
        "vision": 7,
        "anticipation": 6,
        "positioning": 5,
        "decisions": 8,
        "discipline": 11
      }
    }
  ],
  "bench": [
    {
      "id": "B1",
      "name": "Jurre Wolkerveld",
      "role": "keeper",
      "preferredPosition": "GK",
      "attributes": {
        "passing": 9,
        "firstTouch": 10,
        "finishing": 10,
        "dribbling": 10,
        "defending": 10,
        "heading": 11,
        "speed": 12,
        "acceleration": 13,
        "strength": 13,
        "endurance": 10,
        "vision": 7,
        "anticipation": 6,
        "positioning": 5,
        "decisions": 8,
        "discipline": 11
      },
      "keeper": {
        "reflexes": 7,
        "positioning": 7,
        "rushingOut": 7
      }
    },
    {
      "id": "B2",
      "name": "Fedde Zilverbeek",
      "role": "centrale_verdediger",
      "preferredPosition": "RC",
      "attributes": {
        "passing": 9,
        "firstTouch": 10,
        "finishing": 7,
        "dribbling": 10,
        "defending": 11,
        "heading": 11,
        "speed": 12,
        "acceleration": 13,
        "strength": 13,
        "endurance": 10,
        "vision": 7,
        "anticipation": 6,
        "positioning": 5,
        "decisions": 8,
        "discipline": 11
      }
    },
    {
      "id": "B3",
      "name": "Ties Haverhorst",
      "role": "back",
      "preferredPosition": "LB",
      "attributes": {
        "passing": 9,
        "firstTouch": 10,
        "finishing": 10,
        "dribbling": 10,
        "defending": 10,
        "heading": 11,
        "speed": 12,
        "acceleration": 13,
        "strength": 13,
        "endurance": 10,
        "vision": 7,
        "anticipation": 6,
        "positioning": 5,
        "decisions": 8,
        "discipline": 11
      }
    },
    {
      "id": "B4",
      "name": "Melle Duinakker",
      "role": "controlerende_middenvelder",
      "preferredPosition": "RCM",
      "attributes": {
        "passing": 9,
        "firstTouch": 10,
        "finishing": 10,
        "dribbling": 10,
        "defending": 10,
        "heading": 11,
        "speed": 12,
        "acceleration": 13,
        "strength": 13,
        "endurance": 10,
        "vision": 7,
        "anticipation": 6,
        "positioning": 5,
        "decisions": 8,
        "discipline": 11
      }
    },
    {
      "id": "B5",
      "name": "Stijn Wilgenwaard",
      "role": "buitenspeler",
      "preferredPosition": "RM",
      "attributes": {
        "passing": 9,
        "firstTouch": 10,
        "finishing": 10,
        "dribbling": 10,
        "defending": 10,
        "heading": 11,
        "speed": 12,
        "acceleration": 13,
        "strength": 13,
        "endurance": 10,
        "vision": 7,
        "anticipation": 6,
        "positioning": 5,
        "decisions": 8,
        "discipline": 11
      }
    },
    {
      "id": "B6",
      "name": "Bram Schaduwbeek",
      "role": "spits",
      "preferredPosition": "RS",
      "attributes": {
        "passing": 9,
        "firstTouch": 10,
        "finishing": 11,
        "dribbling": 10,
        "defending": 8,
        "heading": 11,
        "speed": 12,
        "acceleration": 13,
        "strength": 13,
        "endurance": 10,
        "vision": 7,
        "anticipation": 6,
        "positioning": 5,
        "decisions": 8,
        "discipline": 11
      }
    },
    {
      "id": "B7",
      "name": "Daan Regenhorst",
      "role": "targetman",
      "preferredPosition": "LS",
      "attributes": {
        "passing": 9,
        "firstTouch": 10,
        "finishing": 11,
        "dribbling": 10,
        "defending": 8,
        "heading": 11,
        "speed": 12,
        "acceleration": 13,
        "strength": 13,
        "endurance": 10,
        "vision": 7,
        "anticipation": 6,
        "positioning": 5,
        "decisions": 8,
        "discipline": 11
      }
    }
  ]
}
